[
  {
    "schema": "clawroute.policy.v1",
    "id": "builder-coding-default",
    "priority": 100,
    "match": {
      "agent_id": ["builder"],
      "task_type": ["coding"]
    },
    "route": {
      "preferred": ["codex-primary", "sonnet-fallback"],
      "max_cost_usd": 0.2
    }
  },
  {
    "schema": "clawroute.policy.v1",
    "id": "cheap-summary-default",
    "priority": 20,
    "match": {
      "task_type": ["summarization", "extraction"],
      "cost_mode": ["cheap", "balanced"]
    },
    "route": {
      "preferred": ["glm-cheap", "local-private", "openrouter-general"],
      "max_cost_usd": 0.05
    }
  },
  {
    "schema": "clawroute.policy.v1",
    "id": "research-general-default",
    "priority": 30,
    "match": {
      "task_type": ["research", "orchestration"]
    },
    "route": {
      "preferred": ["openrouter-general", "sonnet-fallback"],
      "max_cost_usd": 0.2
    }
  },
  {
    "schema": "clawroute.policy.v1",
    "id": "private-mode-default",
    "priority": 80,
    "match": {
      "privacy_mode": ["private", "local-only"]
    },
    "route": {
      "preferred": ["local-private", "sonnet-fallback"],
      "max_cost_usd": 0.1
    }
  }
]
